nome	situacao	posicao	processoSeletivo	curso	escolaridade	cpf 	cidade	estado	lista
LENIR APARECIDA DOS SANTOS	NOMEADA	1	concurso-publico-edital-no-002-2016	Técnico em Contabilidade	Especialização - completa	51907305149	Campo Grande	Mato Grosso do Sul	Ampla Concorrência
DOMYNGOS JOSEPH DE SANTANA VICTOR	NOMEADO	2	concurso-publico-edital-no-002-2016	Técnico em Contabilidade	Graduação - completa	00426124111	Campo Grande	Mato Grosso do Sul	Ampla Concorrência
ISAIAS PEREIRA DE SOUZA	NOMEADO	3	concurso-publico-edital-no-002-2016	Técnico em Contabilidade	Graduação - completa	27179990191	Campo Grande	Mato Grosso do Sul	Ampla Concorrência
FERNANDA DE OLIVEIRA CALISTO	VACÂNCIA POR POSSE EM OUTRO CARGO INACUMULÁVEL 	4	concurso-publico-edital-no-002-2016	Técnico em Contabilidade	Graduação - completa	01139183133	Dourados	Mato Grosso do Sul	Ampla Concorrência
DANIELE MELGAR DE JESUS	DESISTENTE	5	concurso-publico-edital-no-002-2016	Técnico em Contabilidade	Especialização - completa	00625911180	Corumbá	Mato Grosso do Sul	Ampla Concorrência
TIAGO GUIMARÃES BARTH	DESISTENTE	6	concurso-publico-edital-no-002-2016	Técnico em Contabilidade	Mestrado - completo	05303844935	Campo Grande	Mato Grosso do Sul	Ampla Concorrência
MARYANNA FERREIRA REZENDE	NOMEADA	7	concurso-publico-edital-no-002-2016	Técnico em Contabilidade	Graduação - completa	03770502108	Uruaçu	Goiás	Ampla Concorrência
JOCIANE DA COSTA SANCHEZ	DESISTENTE	8	concurso-publico-edital-no-002-2016	Técnico em Contabilidade	Graduação - completa	93322836134	Corumbá	Mato Grosso do Sul	Ampla Concorrência
NATANAEL RODRIGUES DA CRUZ JUNIOR	DESISTENTE	9	concurso-publico-edital-no-002-2016	Técnico em Contabilidade	Graduação - completa	98436708172	Campo Grande	Mato Grosso do Sul	Ampla Concorrência
